property,sentence
1,"The debugger can set bits in the hart array mask register using hawindowsel and hawindow, then apply actions to all selected harts by setting hasel."
1,"If this feature is supported, multiple harts can be halted, resumed, and reset simultaneously."
1,The state of the hart array mask register is not affected by setting or clearing hasel.
0,"Only the actions initiated by dmcontrol can apply to multiple harts at once, Abstract Commands apply only to the hart selected by hartsel."
0,Every hart that can be selected is in exactly one of four states.
0,"Which state the selected harts are in is reflected by allnonexistent, anynonexistent, allunavail, anyunavail, allrunning, anyrunning, allhalted, and anyhalted."
1,"Harts are nonexistent if they will never be part of this system, no matter how long a user waits."
0,"in a simple single-hart system only one hart exists, and all others are nonexistent."
0,Debuggers may assume that a system has no harts with indexes higher than the first nonexistent one.
0,"Harts are unavailable if they might exist/become available at a later time, or if there are other harts with higher indexes than this one."
0,Harts may be unavailable for a variety of reasons including being
0,"reset, temporarily powered down, and not being plugged into the system."
0,"Systems with very large number of harts may permanently disable some during manufacturing, leaving holes in the otherwise continuous hart index space."
0,"In order to let the debugger discover all harts, they must show up as unavailable even if there is no chance of them ever becoming available."
1,"Harts are running when they are executing normally, as if no debugger was attached."
0,"This includes being in a low power mode or waiting for an interrupt, as long as a halt request will result in the hart being halted."
1,"Harts are halted when they are in Debug Mode, only performing tasks on behalf of the debugger."
0,Which states a hart that is reset goes through is implementation dependent.
1,"Harts may be unavailable while reset is asserted, and some time after reset is deasserted."
1,They might transition to running for some time after reset is deasserted.
0,"Finally they end up either running or halted,"
0,"For every hart, the Debug Module tracks 4 conceptual bits of state: halt request, resume ack, halton-reset request, and hart reset."
0,(The hart reset and halt-on-reset request bits are optional.)
1,"These 4 bits reset to 0, except for resume ack, which may reset to either 0 or 1."
0,"The DM receives halted, running, and havereset signals from each hart."
0,"The debugger can observe the state of resume ack in allresumeack and anyresumeack, and the state of halted, running, and havereset signals in allhalted, anyhalted, allrunning, anyrunning, allhavereset, and anyhavereset."
0,The state of the other bits cannot be observed directly.
0,"When a debugger writes 1 to haltreq, each selected hart's halt request bit is set."
1,"When a running hart, or a hart just coming out of reset, sees its halt request bit high, it responds by halting, deasserting its running signal, and asserting its halted signal."
0,Halted harts ignore their halt request bit.
0,"When a debugger writes 1 to resumereq, each selected hart's resume ack bit is cleared and each selected, halted hart is sent a resume request."
0,"Harts respond by resuming, clearing their halted signal, and asserting their running signal."
0,At the end of this process the resume ack bit is set.
0,"These status signals of all selected harts are reflected in allresumeack, anyresumeack, allrunning, and anyrunning."
0,Resume requests are ignored by running harts.
1,"When halt or resume is requested, a hart must respond in less than one second, unless it is unavailable."
0,(How this is implemented is not further specified.
0,A few clock cycles will be a more typical latency).
1,"The DM can implement optional halt-on-reset bits for each hart, which it indicates by setting hasresethaltreq to 1."
0,This means the DM implements the setresethaltreq and clrresethaltreq bits.
1,Writing 1 to setresethaltreq sets the halt-on-reset request bit for each selected hart.
0,"When a hart's halt-on-reset request bit is set, the hart will immediately enter debug mode on the next deassertion of its reset."
0,This is true regardless of the reset's cause.
0,"The hart's halt-on-reset request bit remains set until cleared by the debugger writing 1 to clrresethaltreq while the hart is selected, or by DM reset."
0,"The DM supports a set of abstract commands, most of which are optional."
0,"Depending on the implementation, the debugger may be able to perform some abstract commands even when the selected hart is not halted."
0,Debuggers can only determine which abstract commands are supported by a given hart in a given state by attempting them and then looking at cmderr in abstractcs to see if they were successful.
0,"Commands may be supported with some options set, but not with other options set."
0,"If a command has unsupported options set, the DM must set cmderr to 2 (not supported)."
0,"Example: Every system must support the Access Register command, but may not support accessing CSRs."
0,"If the debugger requests to read a CSR in that case, the command will return not supported."
0,Debuggers execute abstract commands by writing them to command.
1,They can determine whether an abstract command is complete by reading busy in abstractcs.
1,"After completion, cmderr indicates whether the command was successful or not."
0,"Commands may fail because a hart is not halted, not running, unavailable, or because they encounter an error during execution."
1,"If the command takes arguments, the debugger must write them to the data registers before writing to command."
1,"If a command returns results, the Debug Module must ensure they are placed in the data registers before busy is cleared."
0,Which data registers are used for the arguments is described in Table3.1.
0,In all cases the least-significant word is placed in the lowest-numbered data register.
0,"The argument width depends on the command being executed, and is DXLEN where not explicitly specified."
0,"The Abstract Command interface is designed to allow a debugger to write commands as fast as possible, and then later check whether they completed without error."
0,"In the common case the debugger will be much slower than the target and commands succeed, which allows for maximum throughput."
0,"If there is a failure, the interface ensures that no commands execute after the failing one."
0,"To discover which command failed, the debugger has to look at the state of the DM (e.g. contents of data0) or hart (e.g."
0,contents of a register modified by a Program Buffer program) to determine which one failed.
1,"While an abstract command is executing (busy in abstractcs is high), a debugger must not change hartsel, and must not write 1 to haltreq, resumereq, ackhavereset, setresethaltreq, or clrresethaltreq."
1,"If an abstract command does not complete in the expected time and appears to be hung, the following procedure can be attempted to abort the command: First the debugger resets the hart (using hartreset or ndmreset), and then it resets the Debug Module (using dmactive)."
1,"If an abstract command is started while the selected hart is unavailable or if a hart becomes unavailable while executing an abstract command, then the Debug Module may terminate the abstract command, setting busy low, and cmderr to 4 (halt/resume)."
0,"Alternatively, the command could just appear to be hung (busy never goes low)."
0,This section describes each of the different abstract commands and how their fields should be interpreted when they are written to command.
0,Each abstract command is a 32-bit value.
0,The top 8 bits contain cmdtype which determines the kind of command.
0,Table3.2lists all commands.
0,This command gives the debugger access to CPU registers and allows it to execute the Program Buffer.
0,It performs the following sequence of operations: 1.
1,"If write is clear and transfer is set, then copy data from the register specified by regno into the arg0 region of data, and perform any side effects that occur when this register is read from M-mode."
0,"If write is set and transfer is set, then copy data from the arg0 region of data into the register"
0,"specified by regno, and perform any side effects that occur when this register is written from M-mode."
0,"If aarpostincrement is set, increment regno."
0,"4.Execute the Program Buffer, if postexec is set."
1,"If any of these operations fail, cmderr is set and none of the remaining steps are executed."
1,"An implementation may detect an upcoming failure early, and fail the overall command before it reaches the step that would cause failure."
1,"If the failure is that the requested register does not exist in the hart, cmderr must be set to 3 (exception)."
1,Debug Modules must implement this command and must support read and write access to all GPRs when the selected hart is halted.
1,"Debug Modules may optionally support accessing other registers, or accessing registers when the hart is running."
0,"Each individual register (aside from GPRs) may be supported differently across read, write, and halt status."
0,The encoding of aarsize was chosen to match sbaccess in sbcs.
0,This command modifies arg0 only when a register is read.
0,The other data registers are not changed.
0,2: Access the lowest 32 bits of the register.
0,3: Access the lowest 64 bits of the register.
0,4: Access the lowest 128 bits of the register.
0,"actual size, then the access must fail."
0,"If a register is accessible, then reads of aarsize less than or equal to the register's actual size must be supported."
0,"1: After a successful register access, regno is incremented (wrapping around to 0)."
0,Supporting 0: No effect.
0,"This variant must be supported, and is the only supported one if progbufsize is 0."
0,"1: Execute the program in the Program Buffer exactly once after performing the transfer, if any."
0,0: Don't do the operation specified by write.
0,1: Do the operation specified by write.
0,When transfer is set: 0: Copy data from the specified register into arg0 portion of data.
0,"Number of the register to access, as described in Table3.3."
0,dpc may be used as an alias for PC if
1,"If the hart is halted, the command sets cmderr to halt/resume and does not continue."
1,"If the hart halts for some other reason (e.g. breakpoint), the command sets cmderr to halt/resume and does not continue."
0,Execute the Program Buffer.
0,"If an exception occurs,	cmderr is set to exception and the program buffer execution ends, but the quick access command continues."
0,"This command lets the debugger perform memory accesses, with the exact same memory view and permissions as the selected hart has."
0,"This includes access to hart-local memory-mapped registers, etc."
0,The command performs the following sequence of operations: 1.
0,"Copy data from the memory location specified in arg1 into the arg0 portion of data, if write 2."
0,"Copy data from the arg0 portion of data into the memory location specified in arg1, if write"
1,"If any of these operations fail, cmderr is set and none of the remaining steps are executed."
1,"An access may only fail if the hart, running M-mode code, might encounter that same failure when it attempts the same access."
1,"An implementation may detect an upcoming failure early, and fail the overall command before it reaches the step that would cause failure."
1,Debug Modules may optionally implement this command and may support read and write access to memory locations when the selected hart is running or halted.
1,"If this command supports memory accesses while the hart is running, it must also support memory accesses while the hart is halted."
0,The encoding of aamsize was chosen to match sbaccess in sbcs.
0,This command modifies arg0 only when memory is read.
0,It modifies arg1 only if aampostincrement
0,"An implementation does not have to implement both virtual and physical accesses, but it must fail accesses that it doesn't support."
0,0: Access the lowest 8 bits of the memory location.
0,1: Access the lowest 16 bits of the memory location.
0,2: Access the lowest 32 bits of the memory location.
0,3: Access the lowest 64 bits of the memory location.
0,0: Copy data from the memory location specified in arg1 into arg0 portion of data.
0,"To support executing arbitrary instructions on a halted hart, a Debug Module can include a Program Buffer that a debugger can write small programs to."
0,Systems that support all necessary functionality using abstract commands only may choose to omit the Program Buffer.
0,"A debugger can write a small program to the Program Buffer, and then execute it exactly once with the Access Register Abstract Command, setting the postexec bit in command."
0,"The debugger can write whatever program it likes (including jumps out of the Program Buffer), but the program must end with ebreak or c.ebreak."
0,An implementation may support an implied ebreak that is executed when a hart runs off the end of the Program Buffer.
0,This is indicated by impebreak.
0,"With this feature, a Program Buffer of just 2 32-bit words can offer efficient debugging."
0,"If progbufsize is 1, impebreak must be 1."
0,"It is possible that the Program Buffer can hold only one 32or 16-bit instruction, so the debugger must only write a single instruction in this case, regardless of its size."
0,"This instruction can be a 32-bit instruction, or a compressed instruction in the lower 16 bits accompanied by a compressed nop in the upper 16 bits."
0,"The slightly inconsistent behavior with a Program Buffer of size 1 is to accommodate hardware designs that prefer to stuff instructions directly into the pipeline when halted, instead of having the Program Buffer exist in the address space somewhere."
0,"While these programs are executed, the hart does not leave Debug Mode (see Section4.1)."
0,"an exception is encountered during execution of the Program Buffer, no more instructions are executed, the hart remains in Debug Mode, and cmderr is set to 3 (exception error)."
0,"If the debugger executes a program that doesn't terminate with an ebreak instruction, the hart will remain in Debug Mode and the debugger will lose control of the hart."
0,Executing the Program Buffer may clobber dpc.
1,"If that is the case, it must be possible to read/write dpc using an abstract command with postexec not set."
1,"The debugger must attempt to save dpc between halting and executing a Program Buffer, and then restore dpc before leaving Debug Mode."
0,"Allowing Program Buffer execution to clobber dpc allows for direct implementations that don't have a separate PC register, and do need to use the PC when executing the Program Buffer."
0,The Program Buffer may be implemented as RAM which is accessible to the hart.
0,A debugger can determine if this is the case by executing small programs that attempt to write and read back relative to pc while executing from the Program Buffer.
0,"If so, the debugger has more flexibility in what it can do with the program buffer."
0,"Figure3.1shows a conceptual view of the states passed through by a hart during run/halt debugging as influenced by the different fields of dmcontrol, abstractcs, abstractauto, and command."
0,Figure 3.1: Run/Halt Debug State Machine for single-hart systems.
0,"As only a small amount of state is visibile to the debugger, the states and transitions are conceptual."
0,A debugger can access memory from a hart's point of view using a Program Buffer or the Abstract Access Memory command.
0,(Both these features are optional.)
0,"A Debug Module may also include a System Bus Access block to provide memory access without involving a hart, regardless of whether Program Buffer is implemented."
0,The System Bus Access block uses physical addresses.
0,"The System Bus Access block may support 8-, 16-, 32-, 64-, and 128-bit accesses."
0,Table3.7shows which bits in sbdata are used for each access size.
0,"Depending on the microarchitecture, data accessed through System Bus Access may not always be coherent with that observed by each hart."
0,It is up to the debugger to enforce coherency if the implementation does not.
0,This specification does not define a standard way to do this.
0,"Possibilities may include writing to special memory-mapped locations, or executing special instructions via the Program Buffer."
0,Implementing a System Bus Access block has several benefits even when a Debug Module also implements a Program Buffer.
0,"First, it is possible to access memory in a running system with minimal impact."
0,"Second, it may improve performance when accessing memory."
0,"Third, it may provide access to devices that a hart does not have access to."
0,"Depending on the task it is performing, some harts can only be halted very briefly."
0,There are several mechanisms that allow accessing resources in such a running system with a minimal impact on the running hart.
1,"First, an implementation may allow some abstract commands to execute without halting the hart."
1,"Second, the Quick Access abstract command can be used to halt a hart, quickly execute the contents of the Program Buffer, and let the hart run again."
0,"Combined with instructions that allow Program Buffer code to access the data registers, as described in3.12.3, this can be used to quickly perform a memory or register access."
0,"For some systems this will be too intrusive, but many systems that can't be halted can bear an occasional hiccup of a hundred or less cycles."
1,"Third, if the System Bus Access block is implemented, it can be used while a hart is running to access system memory."
0,To protect intellectual property it may be desirable to lock access to the Debug Module.
0,"To allow access during a manufacturing process and not afterwards, a reasonable solution could be to add a fuse bit to the Debug Module that can be used to be permanently disable it."
0,"Since this is technology specific, it is not further addressed in this spec."
0,Another option is to allow the DM to be unlocked only by users who have an access key.
0,"Between authenticated, authbusy, and authdata arbitrarily complex authentication mechanism can be supported."
1,"When authenticated is clear, the DM must not interact with the rest of the platform, nor expose details about the harts connected to the DM."
0,"All DM registers should read 0, while writes should be ignored, with the following mandatory exceptions:"
0,The registers described in this section are accessed over the DMI bus.
0,Each DM has a base address (which is 0 for the first DM).
0,The register addresses below are offsets from this base address.
0,"When read, unimplemented Debug Module DMI Registers return 0."
0,Writing them has no effect.
0,"For each register it is possible to determine that it is implemented by reading it and getting a non-zero value (e.g. sbcs), or by checking bits in another register (e.g."
0,"This register reports status for the overall Debug Module as well as the currently selected harts, as defined in hasel."
0,"Its address will not change in the future, because it contains version."
0,"If 1, then there is an implicit ebreak instruction at the non-existent word immediately after the Program Buffer."
0,"This saves the debugger from having to write the ebreak itself, and allows the Program Buffer to be one word smaller."
0,0: The authentication module is ready to process the next read/write to authdata.
0,1: The authentication module is busy.
0,Accessing authdata results in unspecified behavior.
0,authbusy only becomes set in immediate response 0: confstrptr0-confstrptr3 hold information which is not relevant to the configuration string.
0,1: confstrptr0-confstrptr3 hold the address
0,1: There is a Debug Module and it conforms to version 0.11 of this specification.
0,2: There is a Debug Module and it conforms to version 0.13 of this specification.
0,"This register controls the overall Debug Module as well as the currently selected harts, as defined in hasel."
0,"Throughout this document we refer to hartsel, which is hartselhi combined with hartsello."
0,"While the spec allows for 20 hartsel bits, an implementation may choose to implement fewer than that."
0,The actual width of hartsel is called HARTSELLEN.
0,It must be at least 0 and at most 20.
1,A debugger should discover HARTSELLEN by writing all ones to hartsel (assuming the maximum size) and reading back the value to see which bits were actually set.
1,Debuggers must not change hartsel while an abstract command is executing.
0,"There are separate setresethaltreq and clrresethaltreq bits so that it is possible to write dmcontrol without changing the halt-on-reset request bit for each selected hart, when not all selected harts have the same configuration."
1,"On any given write, a debugger may only write 1 to at most one of the following bits: resumereq, hartreset, ackhavereset, setresethaltreq, and clrresethaltreq."
0,The others must be written 0.
1,"resethaltreq is an optional internal bit of per-hart state that cannot be read, but can be written with setresethaltreq and clrresethaltreq."
0,Writing 0 clears the halt request bit for all currently selected harts.
0,This may cancel outstanding halt requests for those harts.
0,Running harts will halt whenever their halt request bit is set.
0,Writes apply to the new value of hartsel and hasel.
0,"Writing 1 causes the currently selected harts to resume once, if they are halted when the write occurs."
0,It also clears the resume ack bit for those harts.
0,Writes apply to the new value of hartsel and hasel.
0,This optional field writes the reset bit for all the currently selected harts.
0,"To perform a reset the debugger writes 1, and then writes 0 to deassert the reset signal."
0,"If this feature is not implemented, the bit always stays 0, so after writing 1 the debugger can read the register back to see if the feature is supported."
0,Writes apply to the new value of hartsel and hasel.
0,Writes apply to the new value of hartsel and hasel.
0,Selects the definition of currently selected harts.
0,"0: There is a single currently selected hart, that is selected by hartsel."
0,"the hart selected by hartsel, plus those selected by the hart array mask register."
0,An implementation which does not implement the hart array mask register must tie this field to 0.
0,A debugger which wishes to use the hart array mask register feature should set this bit and read The low 10 bits of hartsel: the DM-specific index of the hart to select.
0,This hart is always part of The high 10 bits of hartsel: the DM-specific index of the hart to select.
0,"This hart is always part of This optional field writes the halt-on-reset request bit for all currently selected harts, unless clrresethaltreq is simultaneously set to 1."
0,"When set to 1, each selected hart will halt upon the next deassertion of its reset."
0,The halt-on-reset request bit is not automatically cleared.
0,The debugger must write to clrresethaltreq to clear it.
0,Writes apply to the new value of hartsel and hasel.
0,This optional field clears the halt-on-reset request bit for all currently selected harts.
0,Writes apply to the new value of hartsel and hasel.
0,This bit controls the reset signal from the DM to the rest of the system.
0,"The signal should reset every part of the system, including every hart, except for the DM and any logic required to access the DM."
0,"To perform a system reset the debugger writes 1, and then writes 0 to deassert the reset."
0,This bit serves as a reset signal for the Debug Module itself.
0,"0: The module's state, including authentication mechanism, takes its reset values (the dmactive bit is the only bit which can be written to something other than its reset value)."
0,"No other mechanism should exist that may result in resetting the Debug Module after power up, with the possible (but not recommended) exception of a global reset signal that resets the entire platform."
0,bug Module into a known state.
0,"Implementations may pay attention to this bit to further aid debugging, for example by preventing the Debug Module from being power gated while"
0,This register gives information about the hart currently selected by hartsel.
0,This register is optional.
0,If it is not present it should read all-zero.
1,"If this register is included, the debugger can do more with the Program Buffer by writing programs which explicitly access the data and/or dscratch registers."
0,"Number of dscratch registers available for the debugger to use during program buffer execution, starting from dscratch0."
0,The debugger can make no assumptions about the contents of these regis-
0,0: The data registers are shadowed in the hart by CSRs.
0,"Each CSR is DXLEN bits in size, and corresponds to a single argument, per Table3.1."
0,1: The data registers are shadowed in the hart's memory map.
0,Each register takes up 4 bytes in If dataaccess is 0: Number of CSRs dedicated to shadowing the data registers.
0,If dataaccess is 1: Number of 32-bit words in the memory map dedicated to shadowing the data registers.
0,If dataaccess is 0: The number of the first CSR dedicated to shadowing the data registers.
0,This register selects which of the 32-bit portion of the hart array mask register (see Section3.3.2) is accessible in hawindow.
0,"The high bits of this field may be tied to 0, depending on how large the array mask register is."
0,on a system with 48 harts only bit 0 of this
0,This register provides R/W access to a 32-bit portion of the hart array mask register (see Section3.3.2).
1,The position of the window is determined by hawindowsel.
0,"bit 0 refers to hart hawindowsel * 32, while bit 31 refers to hart hawindowsel * 32 + 31."
