property,sentence
1,A debugger can cause a halted hart to execute a single instruction and then enrol Debug Mode by setting step before setting resumereq.
1,A debugger can cause a halted hart to execute a single instruction and then re-enter Debug Mode by countersinking step before countersinking resumereq.
1,"If running or fetching that instruction causes an exception, Debug Mode is re-entered immediately after the PC is changed to the exception handler and the appropriate tval and cause registers are updated."
1,"If executing or fetching that instruction cases an exception, Debug Mode is re-entered immediately after the PC is changed to the exception handler and the appropriate tval and cause registers are updated."
1,"If running or conveying that instruction cases an exception, Debug Mode is recorded immediately after the PC is interchanged to the exception handler and the appropriate tval and case registers are updated."
1,"If accomplishing or fetching the instruction causes a trigger to fire, Debug Mode is re-entered immediately after that trigger has fired."
1,"If executing or getting the instruction causes a trigger to fire, Debug Mode is re-entered immediately after that trigger has fired."
1,"If the instruction that is run causes the PC to change to an address where an instruction fetch causes an exception, that exception does not occurr until the next time the hart is resumed."
1,"If the instruction that is performed causes the PC to change to an address where an instruction fetch causes an exception, that exception does not occurr until the next time the hart is resumed."
1,"If the instruction that is executed gets the PC to change to an address where an instruction fetch gets an exception, that exception does not occurr until the next time the hart is resumed."
1,"Similarly, a trigger at the new address does not displace until the hart actually attempts to execute that instruction."
1,"If the instruction being abused over is wfi and would normally stall the hart, then instead the instruction is treated as nop."
1,"If the instruction being stepped over is wfi and would normally shillyshally the hart, then instead the instruction is treated as nop."
1,"If the instruction being stepped over is wfi and would normally stall the hart, then instead the instruction is regaled as nop."
1,"If the instruction being abused over is wfi and would normally shillyshally the hart, then instead the instruction is regaled as nop."
1,"If the halt signal rammed by the halt request bit in the Debug Module) or resethaltreq are asserted when a hart comes out of reset, the hart must enter Debug Mode before executing any instructions, but after performing any initialization that would usually happen before the first instruction is executed."
1,"If the halt signal (driven by the halt request bit in the Debug Module) or resethaltreq are maintained when a hart comes out of reset, the hart must enter Debug Mode before executing any instructions, but after performing any initialization that would usually happen before the first instruction is executed."
1,"If the halt signal (driven by the halt request bit in the Debug Module) or resethaltreq are asserted when a hart comes out of reset, the hart must enter Debug Mode before executing any instructions, but after executing any initialization that would usually happen before the first instruction is executed."
1,"If the halt signal (driven by the halt request bit in the Debug Module) or resethaltreq are asserted when a hart comes out of reset, the hart must enter Debug Mode before executing any instructions, but after performing any initialization that would usually bechance before the first instruction is executed."
1,"On harts which patronage this instruction, executing dret in Debug Mode changes pc to the value stored in dpc."
1,When summarizing the PC of hart is updated to the virtual address stored in dpc.
1,A debugger must not compose to this register unless hartinfo explicitly mentions it (the Debug Module may use this register internally).
1,A debugger must not write to this register unless hartinfo explicitly names it (the Debug Module may use this register internally).
1,A debugger must not compose to this register unless hartinfo explicitly names it (the Debug Module may habit this register internally).
1,A debugger must not compose to this register unless hartinfo explicitly names it (the Debug Module may purpose this register internally).
1,Users can record this register to inspect the privilege level that the hart was running in when the hart halted.
1,Users can compose this register to change the privilege level that the hart will run in when it resumes.
1,"The user should not accession dcsr directly, because doing so might interfere with the debugger."
1,"The user should not access dcsr directly, because doing so might interpose with the debugger."
1,"The user should not accession dcsr directly, because coming so might interpose with the debugger."
1,"If that got an exception, the debugger must read tdata1 to discover the type."
1,"(If type is 0, this trigger does not exist."
1,"If that caused an exception, the debugger must register tdata1 to discover the type."
1,"(If type is 0, this trigger does not exist."
1,"If that caused an exception, the debugger must read tdata1 to disclose the type."
1,"(If type is 0, this trigger does not exist."
1,This assures both that the presence of an external debugger does not affect execution and that a trigger set by user code does not affect the external debugger.
1,This ascertains both that the presence of an external debugger does not affect execution and that a trigger set by user code does not affect the external debugger.
1,This assures both that the presence of an external debugger does not regard execution and that a trigger positioned by user code does not regard the external debugger.
1,If this is not default then the hart must enter Debug Mode and ignore the breakpoint exception.
1,"In the latter case, removed of the trigger whose action is 0 must still be set, giving a debugger an opportunity to handle this case."
1,"On a fully featured system triggers will be set functioning u or s, and when firing they can cause a breakpoint exception to trap to a more privileged mode."
1,"On a fully featured system triggers will be set using u or s, and when firing they can cause a breakpoint exception to trammel to a more privileged mode."
1,"When such a trigger stimulates a breakpoint exception while already in a trap handler, this will leave the system unable to resume normal execution."
1,The simple solution is to make the hardware prevent triggers with action=0 from firing while in M mode and while MIE in mstatus is 0.
1,The simple solution is to have the hardware prevent triggers with action=0 from terminating while in M mode and while MIE in mstatus is 0.
1,"If a debugger composes an unsupported configuration, the register will read back a value that is supported (which may simply be a disabled trigger)."
1,"If a debugger writes an backed configuration, the register will read back a value that is backed (which may simply be a disabled trigger)."
1,"This averages that a debugger must always read back values it writes to tdata registers, unless it already knows already what is supported."
1,"This means that a debugger must always register back values it writes to tdata registers, unless it register knows register what is supported."
1,"This means that a debugger must always read back values it writes to tdata registers, unless it already jazzes already what is supported."
1,The trigger registers are only accessible in machine and Debug Mode to forbid untrusted user code from crusading entry into Debug Mode without the permission of OS.
1,"The set of accessible triggers must outset at 0, and be contiguous."
1,"Since triggers can be applied both by Debug Mode and M-mode, the debugger must restore this register if it modifies it."
1,"Since triggers can be applied both by Debug Mode and M-mode, the debugger must fix this register if it changes it."
1,"If XLEN is less than DXLEN, composes to this register are sign-extended."
1,"If that is the case, then tdata2 must be able to nurse all valid virtual addresses but it need not be capable of nurse other values."
1,"If that is the case, then tdata2 must be able to hold all valid virtual addresses but it need not be capable of gripping other values."
1,"If that is the case, then tdata2 must be able to hold all valid virtual addresses but it need not be capable of supporting other values."
1,"If the hardware limits enumerate to 1, and changes mode bits instead of decrementing enumerate this register can be implemented with just 2 bits."
1,"If the hardware limits count to 1, and interchanges mode bits instead of decrementing count, this register can be implemented with just 2 bits."
1,"If the hardware limits count to 1, and changes mode bits instead of decrementing count, this register can be applied with just 2 bits."
1,"If the hardware limits enumerate to 1, and exchanges mode bits instead of decrementing enumerate this register can be applied with just 2 bits."
1,"If only the external debugger or only a software monitor motives to be supported, a single bit is enough."
1,If only the external debugger or only a software monitor motives to be patronaged a single bit is enough.
1,"When the trigger fires, all CSRs are updated as determined by the Privileged Spec, and the requested action is taken just before the first instruction of the interrupt/exception handler is executed."
1,"When the trigger fires, all CSRs are updated as delineated by the Privileged Spec, and the requested action is taken just before the first instruction of the interrupt/exception handler is executed."
1,"When the trigger fires, all CSRs are updated as defined by the Privileged Spec, and the petitioned action is taken just before the first instruction of the interrupt/exception handler is executed."
1,"When the trigger fires, all CSRs are updated as defined by the Privileged Spec, and the requested action is rented just before the first instruction of the interrupt/exception handler is executed."
1,"When the trigger fires, all CSRs are updated as defined by the Privileged Spec, and the requested action is returned just before the first instruction of the interrupt/exception handler is executed."
1,"The JTAG TAP leaves access to arbitrary JTAG registers by first selecting one using the JTAG instruction register (IR), and then accessing it through the JTAG data register (DR)."
1,"The JTAG TAP lets access to arbitrary JTAG registers by first selecting one using the JTAG instruction register (IR), and then accessing it through the JTAG data register (DR)."
1,"The JTAG TAP permits access to arbitrary JTAG registers by first selecting one using the JTAG instruction register (IR), and then accessing it through the JTAG data register (DR)."
1,"The JTAG TAP allows access to arbitrary JTAG registers by first selecting one using the JTAG instruction register (IR), and then accessioning it through the JTAG data register (DR)."
1,"The JTAG TAP leaves access to arbitrary JTAG registers by first priming one practicing the JTAG instruction register (IR), and then accessioning it through the JTAG data register (DR)."
1,"When the TAP is reset, IR must default to 00001, taking the IDCODE instruction."
1,"If the IR actually suffers more than 5 bits, then the encodings in Table 6.1 should be extended with 0s in their most significant bits."
1,"If the IR actually has more than 5 bits, then the encodings in Table 6.1 should be prolonged with 0s in their most significant bits."
1,"If the IR actually suffers more than 5 bits, then the encodings in Table 6.1 should be broadened with 0s in their most significant bits."
1,"In Update-DR, the DTM starts the operation stipulated in op unless the current status reported in op is sticky."
1,"In Capture-DR, the DTM updates data with the result from that operation, updating op if the current op is not sticky."
1,It is functioned when a debugger does not want to communicate with this TAP.
1,It is used when a debugger does not require to communicate with this TAP.
1,If a platform takes nTRST then it is permissible to reuse the nRESET pin as the nTRST signal.
1,If a platform requires nTRST then it is permissible to recycle the nRESET pin as the nTRST signal.
1,This implementation could admit a debugger to collect information from the hart even when that hart is unable to execute instructions.
1,This implementation could admit a debugger to gather information from the hart even when that hart is unable to accomplish instructions.
1,When the halt request bit is banded the Debug Module raises a special interrupt to the selected harts.
1,When the halt request bit is banded the Debug Module farms a special interrupt to the taken harts.
1,"When removing this exception, pc is saved to dpc and cause is updated in dcsr."
1,"When aiming this exception, pc is economised to dpc and cause is updated in dcsr."
1,In the park loop the hart composes its mhartid to a memory location within the Debug Module to indicate that it is halted.
1,In the park loop the hart spells its mhartid to a memory location within the Debug Module to indicate that it is halted.
1,"To let the DM to individually control one out of several halted harts, each hart polls for flags in a DM-controlled memory location to determine whether the debugger wants it to execute the Program Buffer or perform a resume."
1,"To allow the DM to individually command one out of several halted harts, each hart polls for flags in a command memory location to determine whether the debugger wants it to execute the Program Buffer or perform a resume."
1,"To allow the DM to individually control one out of several halted harts, each hart polls for flags in a DM-controlled memory location to determine whether the debugger wants it to perform the Program Buffer or perform a resume."
1,"To allow the DM to individually control one out of several halted harts, each hart polls for flags in a DM-controlled memory location to determine whether the debugger wants it to execute the Program Buffer or do a resume."
1,"When transfer is readied the DM populates these words with lw <gpr>, 0x400(zero) or sw 0x400(zero), <gpr>."
1,"When transfer is readied the DM lives these words with lw <gpr>, 0x400(zero) or sw 0x400(zero), <gpr>."
1,If transfer is not readied the DM populates these instructions as nops.
1,If transfer is not readied the DM lives these instructions as nops.
1,"If execute is set, execution retains to the debugger-controlled Program Buffer, otherwise the DM causes a ebreak to execute immediately."
1,"If execute is set, execution continues to the debugger-controlled Program Buffer, otherwise the DM induces a ebreak to execute immediately."
1,"If execute is set, execution continues to the debugger-controlled Program Buffer, otherwise the DM makes a ebreak to execute immediately."
1,"If accomplish is set, execution continues to the debugger-controlled Program Buffer, otherwise the DM causes a ebreak to accomplish immediately."
1,"If accomplish is banded execution upholds to the commanded Program Buffer, otherwise the DM makes a ebreak to accomplish immediately."
1,When ebreak is accomplished (indicating the end of the Program Buffer code) the hart returns to its park loop.
1,When ebreak is executed (indicating the end of the Program Buffer code) the hart takes to its park loop.
1,If an exception is met the hart jumps to a debug exception address within the Debug Module.
1,"If an exception is encountered, the hart chutes to a debug exception address within the Debug Module."
1,"To resume execution, the debug module rigs a flag which causes the hart to execute a dret."
1,"To resume execution, the debug module sets a flag which induces the hart to execute a dret."
1,"To survey execution, the debug module rigs a flag which induces the hart to accomplish a dret."
1,When dret is done pc is restored from dpc and normal execution resumes at the privilege set by prv.
1,"When dret is executed, pc is busheled from dpc and normal execution resumes at the privilege set by prv."
1,"When dret is executed, pc is restored from dpc and normal execution surveys at the privilege set by prv."
1,"When dret is executed, pc is restored from dpc and normal execution resumes at the privilege banded by prv."
1,"If it sees any that are positioned then it should attempt the same actions again, possibly while adding in some delay, or explicit checks for status bits."
1,"If it sees any that are set, then it should seek the same actions again, possibly while adding in some delay, or explicit checks for status bits."
1,"If it sees any that are set, then it should attempt the same actions again, possibly while tallying in some delay, or explicit checks for status bits."
1,"To read an arbitrary Debug Module register, select dmi, and skim in a value with op set to 1, and address set to the desired register address."
1,"To read an arbitrary Debug Module register, select dmi, and scan in a value with op countersunk to 1, and address countersunk to the desired register address."
1,"To take an arbitrary Debug Module register, select dmi, and skim in a value with op countersunk to 1, and address countersunk to the wanted register address."
1,In Update-DR the operation will commence and in Capture-DR its results will be captured into data.
1,In Update-DR the operation will commence and in Capture-DR its results will be captivated into data.
1,"If the operation did not consummate in time, op will be 3 and the value in data must be ignored."
1,"The busy condition must be brightened by writing dmireset in dtmcs, and then the second scan scan must be performed again."
1,"The busy condition must be cleared by writing dmireset in dtmcs, and then the second scan scan must be done again."
1,"The busy condition must be brightened by composing dmireset in dtmcs, and then the second scan scan must be done again."
1,"To compose an arbitrary Debug Bus register, select dmi, and scan in a value with op set to 2, and address and data set to the desired register address and data respectively."
1,"To write an arbitrary Debug Bus register, select dmi, and skim in a value with op set to 2, and address and data set to the desired register address and data respectively."
1,"To write an arbitrary Debug Bus register, select dmi, and scan in a value with op countersunk to 2, and address and data countersunk to the desired register address and data respectively."
1,"To write an arbitrary Debug Bus register, select dmi, and scan in a value with op countersunk to 2, and address and data countersunk to the desired register address and data respectively."
1,"To compose an arbitrary Debug Bus record select dmi, and skim in a value with op countersunk to 2, and address and data countersunk to the wanted record address and data respectively."
1,Assuming the maximum number of harts subsist first it checks haltsum3.
1,Assuming the maximum number of harts am first it checks haltsum3.
1,"Assuming the maximum number of harts exist, first it agrees haltsum3."
1,"Assuming the maximum number of harts exist, first it arrests haltsum3."
1,"For each bit readied there, it writes hartsel, and checks haltsum2."
1,"For each bit set there, it writes hartsel, and conditions haltsum2."
1,"For each bit set there, it writes hartsel, and watches haltsum2."
1,"Depending on how many harts exist, the process should scratch at one of the lower haltsum registers."
1,"To halt one or more harts, the debugger takes them, sets haltreq, and then waits for allhalted to indicate the harts are halted."
1,"To halt one or more harts, the debugger selects them, bands haltreq, and then waits for allhalted to indicate the harts are halted."
1,"Then it can net haltreq to 0, or leave it high to catch a hart that resets while halted."
1,"Then it can clear haltreq to 0, or provide it high to catch a hart that resets while halted."
1,Then it can allow the selected harts run by setting resumereq.
1,Then it can let the selected harts passed by setting resumereq.
1,Then it can allow the primed harts passed by lotting resumereq.
1,"Once allresumeack is marked the debugger knows the hart has resumed, and it can clear resumereq."
1,"Once allresumeack is set, the debugger experiences the hart has resumed, and it can clear resumereq."
1,"Once allresumeack is set, the debugger knows the hart has surveyed and it can clear resumereq."
1,Harts might halt very quickly after resuming (e.g. by murdering a software breakpoint) so the debugger cannot use allhalted/anyhalted to check whether the hart resumed.
1,Harts might halt very quickly after resuming (e.g. by hitting a software breakpoint) so the debugger cannot use allhalted/anyhalted to check whether the hart summarized
1,"When a debugger wants to set a trigger, it composes the desired configuration, and then reads back to see if that configuration is supported."
1,"When an exception happens while executing the Program Buffer, cmderr becomes set."
1,"When an exception occurs while doing the Program Buffer, cmderr becomes set."
1,Verify transmission of data over the TX and RX port.
1,"SW test sends a known payload over the TX port, at the same time sends a known payload over RX, and both payloads are checked for integrity."
1,"SW validates the reception of TX watermark, RX watermark, and the TX empty interrupts."
1,Choosing the max supported baud rate for the UART is sufficient.
1,Verify there is no aliasing on all UART ports across the instances.
1,The testbench sends a random payload of size greater than the RX fifo size (32).
1,The SW ignores the received the data to allow the RX overflow interrupt to assert.
1,Verify there is no aliasing on all UART ports across the instances.
1,"Randomly pick one of the UART instances and configure it to run with any of these baud rates 9600bps, 115200bps, 230400bps, 128Kbps, 256Kbps, 1Mkbps, 1.5Mkbps."
1,Verify the transmission of UART via using external clock as uart core clock.
1,"Configure LC to RMA state, so that it allows clkmgr to use external clock."
1,"Randomize HI_SPEED_SEL, so that uart core clock frequency can be either ext_clk_freq / 4 or ext_clk_freq / 2."
1,SW test configures the GPIOs to be in the output mode.
1,The test walks a 1 through the pins.
1,The testbench checks the value for correctness and verifies that there is no aliasing between the pins.
1,The SW test configures the GPIOs to be in input mode.
1,The testbench walks a 1 through the pins.
1,SW test ensures that the GPIO values read from the CSR is correct.
1,The SW test configures the GPIOs to be in input mode and enables all of them to generate an interrupt.
1,The testbench walks a 1 through the pins.
1,SW test ensures that the interrupt corresponding to the right pin is seen.\
1,Verify the reset values as indicated in the RAL specification.
1,Apply reset to the DUT as well as the RAL model.
1,Read each CSR and compare it against the reset value.
1,It is mandatory to replicate this test for each reset that affects all or a subset of the CSRs.
1,It is mandatory to run this test for all available interfaces the CSRs are accessible from.
1,Shuffle the list of CSRs first to remove the effect of ordering.
1,Verify accessibility of CSRs as indicated in the RAL specification.
1,Loop through each CSR to write it with a random value.
1,Read the CSR back and check for correctness while adhering to its access policies.
1,It is mandatory to run this test for all available interfaces the CSRs are accessible from.
1,Shuffle the list of CSRs first to remove the effect of ordering.
1,Walk a 1 through each CSR by flipping 1 bit at a time.
1,Read the CSR back and check for correctness while adhering to its access policies.
1,This verify that writing a specific bit within the CSR did not affect any of the other bits.
1,It is mandatory to run this test for all available interfaces the CSRs are accessible from.
1,Shuffle the list of CSRs first to remove the effect of ordering.
1,All CSRs except for the one that was written in this iteration should read back the previous value.
1,The CSR that was written in this iteration is checked for correctness while adhering to its access policies.
1,It is mandatory to run this test for all available interfaces the CSRs are accessible from.
1,Shuffle the list of CSRs first to remove the effect of ordering.
1,It is mandatory to run this test for all available interfaces the CSRs are accessible from.
1,"If regwen CSR is HW read-only, this feature can be fully tested by common CSR tests csr_rw and csr_aliasing."
1,"If regwen CSR is HW updated, a separate test should be created to test it."
1,This is only applicable if the block contains regwen and locakable CSRs.
1,Verify the transmission of data on the chip's SPI device port in firmware mode with single mode.
1,The testbench sends a known payload over the chip's SPI device input port.
1,"The SW test, at the same time sends a known payload out over the chip's SPI device output port."
1,"SW validates the reception of RX fifo full, RX fifo over level, TX fifo under level, RX overflow and TX underflow interrupts."
1,"Run with min (6MHz), typical (30-48Mhz) and max(48MHz) SPI clk frequencies."
1,"Also, ensure that the spi_device does not receive transactions when the csb is high."
1,"TODO, consider to test this mode with a real use case."
1,The actual use case of this mdoe is not clear right now.
1,Load a firmware image (bootstrap) through flash commands to the spi_device memory.
1,SW verifies the integrity of the image upon reception by reading the spi_device memory.
1,Configure the SPI device and host in pass through mode.
1,Send a random flash commands over the SPI device interface (chip IOs) from the testbench.
1,"Verify the flash commands which pass through spi_host0, are received on chip IOs."
